Name,Description,Latitude,Longitude,InfoURL,ImageURL
UCSB,A great university located along the California coast!,34.416929,-119.845991,"https://en.wikipedia.org/wiki/University_of_California,_Santa_Barbara",https://web.physics.ucsb.edu/~Women/images/ucsb-big.jpg
Avalon,A beautiful island town and popular tourist destination off the coast of Long Beach.,33.341826,-118.326449,"https://en.wikipedia.org/wiki/Avalon,_California",https://upload.wikimedia.org/wikipedia/commons/thumb/1/1b/Lightmatter_Avalon_Bay.jpg/600px-Lightmatter_Avalon_Bay.jpg
Monkey Face at Upper Bidwell Park,A animalistic rock formation in Chico!,39.774767,-121.776028,https://theorion.com/71340/sports/monkey-face-makes-great-spring-break-hike/,https://theorion.com/wp-content/uploads/2018/03/20180319_212502-900x675.jpg
Santa Cruz Beach Boardwalk,A popular tourist destination on the Santa Cruz beachfront.,36.964173,-122.018727,https://beachboardwalk.com,https://upload.wikimedia.org/wikipedia/commons/thumb/8/8e/Santa_Cruz_Boardwalk%2C_Santa_Cruz%2C_CA%2C_US_-_Diliff.jpg/3000px-Santa_Cruz_Boardwalk%2C_Santa_Cruz%2C_CA%2C_US_-_Diliff.jpg
Fort Bragg Glass Beach,A Northern California beach home to thousands of colorful glass pieces.,39.452567,-123.813483,https://www.californiabeaches.com/beach/glass-beach/,https://upload.wikimedia.org/wikipedia/commons/thumb/2/23/Glass_Beach_Fort_Bragg.jpg/568px-Glass_Beach_Fort_Bragg.jpg
Eureka ,A Northern California coastal town known for being home to wondrous Redwoods.,40.774052,-124.188051,"https://en.wikipedia.org/wiki/Eureka,_California",https://upload.wikimedia.org/wikipedia/commons/thumb/9/9f/Humboldt_Bay_and_Eureka_aerial_view.jpg/500px-Humboldt_Bay_and_Eureka_aerial_view.jpg